{
  "$schema": "http://json-schema.org/draft-07/schema#",
  "$id": "https://data.quipsapp.com/schema/collection.schema.json",
  "title": "Quips collection file",
  "description": "Shape of a single collections/<id>.json file. Enforced in CI by scripts/validate_collections.py, which performs additional cross-file checks this schema cannot express.",
  "type": "object",
  "required": ["id", "name", "description", "author", "colorName", "iconName", "category", "lastUpdated", "quotes"],
  "additionalProperties": true,
  "properties": {
    "id": { "type": "string", "pattern": "^[a-z0-9-]+$" },
    "name": { "type": "string", "minLength": 1 },
    "description": { "type": "string" },
    "author": { "type": "string" },
    "colorName": { "type": "string" },
    "iconName": { "type": "string" },
    "category": { "type": "string" },
    "lastUpdated": { "type": "string", "pattern": "^\\d{4}-\\d{2}-\\d{2}T\\d{2}:\\d{2}:\\d{2}Z$" },
    "quotes": {
      "type": "array",
      "items": { "$ref": "#/definitions/quote" }
    }
  },
  "definitions": {
    "quote": {
      "type": "object",
      "required": ["id", "content", "authorName", "source", "verificationStatus", "notes"],
      "additionalProperties": true,
      "properties": {
        "id": { "type": "string", "pattern": "^[a-z0-9]+-\\d{3,}$" },
        "content": { "type": "string", "minLength": 1 },
        "authorName": { "type": "string" },
        "source": { "type": "string" },
        "notes": { "type": "string" },
        "verificationStatus": {
          "type": "string",
          "enum": ["verified", "attributed", "unverified", "folk-wisdom"]
        },
        "sourceType": {
          "type": "string",
          "enum": [
            "unspecified", "inPerson", "book", "article", "newspaper", "magazine",
            "comic", "movie", "television", "podcast", "radio", "song", "speech",
            "interview", "website", "socialMedia", "video", "letter", "poem", "play",
            "lecture", "documentary"
          ]
        },
        "quoteDate": { "type": "string" }
      }
    }
  }
}
